{
  "domain": "low-price-sampling",
  "version": 2,
  "sample_id": "record-008",
  "actors": [
    "质量监管中心",
    "电商平台",
    "批发市场执法人员",
    "检验实验室"
  ],
  "facts": [
    "监管计划对价格畸低、安全风险大和历史合格率不高产品加大抽查",
    "电商平台与批发市场是重点抽查领域",
    "监管将提高线上线下一致性",
    "电商链接不断迁移、批发市场摊位频繁更换，单一低价阈值布控容易被规避",
    "单一低价阈值会让有限检验能力反复投向同一类商品",
    "风险布控综合价格分布、历史抽检、投诉、认证、商家关联与渠道曝光",
    "每个样品入选须结合地区、品类与实验室能力说明原因",
    "主体改名、季节波动、计划撞车、样品失效或风险突然升级时可以重排资源",
    "重排后原始计划仍需保留，供复盘命中率、覆盖盲区与商家规避行为"
  ],
  "constraints": [
    "多源风险画像",
    "抽样资源编排",
    "主体关联识别",
    "布控效果复盘",
    "低价本身绝不能直接成为违法结论",
    "现场人员只接收执行所需线索",
    "平台按正式请求提供商品信息",
    "重排资源时保留原始计划"
  ],
  "risk_signals": [
    "价格分布",
    "历史抽检",
    "投诉",
    "认证",
    "商家关联",
    "渠道曝光"
  ],
  "replan_triggers": [
    "主体改名",
    "季节波动",
    "计划撞车",
    "样品失效",
    "风险突然升级"
  ],
  "review_metrics": [
    "命中率",
    "覆盖盲区",
    "商家规避行为"
  ]
}
